,Speaker,transcript_text,clean_transcript_text,date
0,CHAIR YELLEN,CHAIR YELLEN Good afternoon everyone I’d like to welcome back First Vice Presidents Holcomb and Prichard who will again be representing Dallas and Philadelphia respectivelyOn a sad note my understanding is that this is the last fomc meeting for New York First Vice President Chris Cumming Chris has attended 92 fomc meetings 70 of which she attended as an alternate voter And as all of you know Chris has been involved in a wide array of System work over many years in all facets of what we do and has been a very wonderful colleague Chris I really thank you for your service and want you to know that you will be very much missed [Applause]Next I’m pleased to let you know that Brian Madigan has agreed to return to the Board’s Division of Monetary Affairs as deputy director reporting to Thomas effective June 1 I think all of you know that Brian served as director of the division and as fomc secretary from 2007 to 2010 Since he retired from the Board Brian has been a visiting professor in the Department of Economics at Georgetown UniversityNow as I think many of you know in recent years the job of director of the Division of Monetary Affairs has become increasingly burdensome It has entailed serving as the Committee’s chief monetary policy advisor as secretary of the fomc and as leader of a large organization with critical responsibilities As part of a strategy to create a more sustainable situation Brian will have oversight responsibility for the fomc Secretariat and will play a key role in the production of the minutes and transcripts of fomc meetings Obviously these are things he has done superbly well in the past and for which he is eminently well qualifiedAccordingly I intend to propose that Brian be appointed by the fomc as its secretary Unless there are objections I will ask the fomc Secretariat to send out a request in early June for notation votes to select Brian as our secretary Under this arrangement Thomas will continue to serve as the Committee’s primary advisor on monetary policy and will also be able to dedicate more of his energy to ensuring that the Division of Monetary Affairs fulfills its critical role in supporting our monetary policy and other responsibilitiesOkay Now the first two items on our agenda today will be considered in a joint meeting of the fomc and the Board of Governors and accordingly I need a motion tose the Board meeting,Good afternoon everyone I’d like to welcome back First Vice Presidents Holcomb and Prichard who will again be representing Dallas and Philadelphia respectivelyOn a sad note my understanding is that this is the last fomc meeting for New York First Vice President Chris Cumming Chris has attended 92 fomc meetings 70 of which she attended as an alternate voter And as all of you know Chris has been involved in a wide array of System work over many years in all facets of what we do and has been a very wonderful colleague Chris I really thank you for your service and want you to know that you will be very much missed [Applause]Next I’m pleased to let you know that Brian Madigan has agreed to return to the Board’s Division of Monetary Affairs as deputy director reporting to Thomas effective June 1 I think all of you know that Brian served as director of the division and as fomc secretary from 2007 to 2010 Since he retired from the Board Brian has been a visiting professor in the Department of Economics at Georgetown UniversityNow as I think many of you know in recent years the job of director of the Division of Monetary Affairs has become increasingly burdensome It has entailed serving as the Committee’s chief monetary policy advisor as secretary of the fomc and as leader of a large organization with critical responsibilities As part of a strategy to create a more sustainable situation Brian will have oversight responsibility for the fomc Secretariat and will play a key role in the production of the minutes and transcripts of fomc meetings Obviously these are things he has done superbly well in the past and for which he is eminently well qualifiedAccordingly I intend to propose that Brian be appointed by the fomc as its secretary Unless there are objections I will ask the fomc Secretariat to send out a request in early June for notation votes to select Brian as our secretary Under this arrangement Thomas will continue to serve as the Committee’s primary advisor on monetary policy and will also be able to dedicate more of his energy to ensuring that the Division of Monetary Affairs fulfills its critical role in supporting our monetary policy and other responsibilitiesOkay Now the first two items on our agenda today will be considered in a joint meeting of the fomc and the Board of Governors and accordingly I need a motion tose the Board meeting,20150429
1,MR FISCHER,MR FISCHER So moved,So moved,20150429
2,CHAIR YELLEN,CHAIR YELLEN Thank you Without objection Our first item is financial developments and open market operations and let me call on Simon to deliver the Desk report,Thank you Without objection Our first item is financial developments and open market operations and let me call on Simon to deliver the Desk report,20150429
