,Speaker,transcript_text,clean_transcript_text,date
131,MR KOCHERLAKOTA,MR KOCHERLAKOTA Thank you Madam Chair I appreciate the thoughtful analysis and the memos that discuss the intermeeting governance of the rate on rate and other policy tools during the early weeks of liftoff I thought that the approach described of scheduling daily staff briefings during those first few weeks is prudent and should meet our needs initially given that we could convert them to official meetings as neededOne thing I would note is that it might not always be clear what it would mean to “settle down” so if liftoff takes place say in mid-June or mid-September things might settle down after the passage of quarter-end and then you might have this issue of whether that is really settling down from the point of view of being able to deal with quarter-end You might want to have staff briefings again scheduled for the end of the following quarter which I guess if we raised in September would be at the end of December I think just the passage of time is not necessarily going to tell you that this is going to be working and working fine I think that is something to keep in mind as we go forwardThe staff memo noted that there are quorum rules for the Committee Those might be useful in the context of these staff briefings Not everyone needs to be here for every meeting and the Committee still can operate That might come up in this situation I didn’t say this at the very beginning but I should say that I am very confident that this is all about contingency planning I am confident the tools are going to work I think these meetings are going to become boring very quickly It is going to be like the call Not to say that’s boring but— [laughter]—I misspoke But it will become routine at least That’s our baseline scenario but I do think it’s useful to engage in this contingency planningI think I am going to be in the minority on my next point which is can we transition to a situation in which we simply delegate so-called technical decisions to the Chair? Here I am not supportive of that delegation and my answer there is shaped by three considerations First when my staff and I thought about the context in which increases in the on rate would be considered we weren’t sure that those situations would be that technical per se or tactical It seemed like those would be situations in which the effective federal funds rate would be below the bottom of the target range and that seemed likely to occur in conjunction with the cap on the on volume being binding Then there would be some interaction at least in your discussion about raising the on rate and also discussion about raising the cap Now the cap is a big deal We have talked about that at length The Committee certainly has strong views about that It just immediately seemed to bring substantive issues into playThe second consideration is that as I listen to people talk about analogies with the past if we were talking about delegating to the staff I would almost be more comfortable with that than delegating to the Chair [Laughter] I say that because I think if it is routine enough to be delegated to staff we can delegate it to the staff This is clearly not routine enough to delegate to the staff This is about the Committee deciding that a decision which is not sufficiently routine to delegate to the staff is being delegated to the Chair instead That is not something I feel as comfortable withThird basically there is an issue here of precedent This is not about this Chair I feel perfectly comfortable with you Madam Chair and your discretion in this matter But future Committees may not have that level of comfort with future Chairs in related situations Getting together for meetings is hard and challenging It is always easy to delegate and I think we wantto fight that tendency especially in view of how easy modern technology makes it to pull together a quorum of the Committee for substantive discussion and deliberationsFor these reasons Madam Chair I recommend that the Committee not delegate authority for intermeeting adjustments to the Chair Again this is all about contingency planning but I think the Committee could make contingency plans to vote as needed between scheduled meetings be it by telephone videoconference telepresence secure lines—all of the other suggestions that are out thereA quick comment on the primary credit spread I thought the idea of doing more research and work on this was a very interesting one At liftoff especially if we are going to be doing liftoff in the near term the June–September time frame I would favor keeping the 50 basis point primary credit spread at that time then continuing to do work on the issue before we decideThank you,Thank you Madam Chair I appreciate the thoughtful analysis and the memos that discuss the intermeeting governance of the rate on rate and other policy tools during the early weeks of liftoff I thought that the approach described of scheduling daily staff briefings during those first few weeks is prudent and should meet our needs initially given that we could convert them to official meetings as neededOne thing I would note is that it might not always be clear what it would mean to “settle down” so if liftoff takes place say in mid-June or mid-September things might settle down after the passage of quarter-end and then you might have this issue of whether that is really settling down from the point of view of being able to deal with quarter-end You might want to have staff briefings again scheduled for the end of the following quarter which I guess if we raised in September would be at the end of December I think just the passage of time is not necessarily going to tell you that this is going to be working and working fine I think that is something to keep in mind as we go forwardThe staff memo noted that there are quorum rules for the Committee Those might be useful in the context of these staff briefings Not everyone needs to be here for every meeting and the Committee still can operate That might come up in this situation I didn’t say this at the very beginning but I should say that I am very confident that this is all about contingency planning I am confident the tools are going to work I think these meetings are going to become boring very quickly It is going to be like the call Not to say that’s boring but— [laughter]—I misspoke But it will become routine at least That’s our baseline scenario but I do think it’s useful to engage in this contingency planningI think I am going to be in the minority on my next point which is can we transition to a situation in which we simply delegate so-called technical decisions to the Chair? Here I am not supportive of that delegation and my answer there is shaped by three considerations First when my staff and I thought about the context in which increases in the on rate would be considered we weren’t sure that those situations would be that technical per se or tactical It seemed like those would be situations in which the effective federal funds rate would be below the bottom of the target range and that seemed likely to occur in conjunction with the cap on the on volume being binding Then there would be some interaction at least in your discussion about raising the on rate and also discussion about raising the cap Now the cap is a big deal We have talked about that at length The Committee certainly has strong views about that It just immediately seemed to bring substantive issues into playThe second consideration is that as I listen to people talk about analogies with the past if we were talking about delegating to the staff I would almost be more comfortable with that than delegating to the Chair [Laughter] I say that because I think if it is routine enough to be delegated to staff we can delegate it to the staff This is clearly not routine enough to delegate to the staff This is about the Committee deciding that a decision which is not sufficiently routine to delegate to the staff is being delegated to the Chair instead That is not something I feel as comfortable withThird basically there is an issue here of precedent This is not about this Chair I feel perfectly comfortable with you Madam Chair and your discretion in this matter But future Committees may not have that level of comfort with future Chairs in related situations Getting together for meetings is hard and challenging It is always easy to delegate and I think we wantto fight that tendency especially in view of how easy modern technology makes it to pull together a quorum of the Committee for substantive discussion and deliberationsFor these reasons Madam Chair I recommend that the Committee not delegate authority for intermeeting adjustments to the Chair Again this is all about contingency planning but I think the Committee could make contingency plans to vote as needed between scheduled meetings be it by telephone videoconference telepresence secure lines—all of the other suggestions that are out thereA quick comment on the primary credit spread I thought the idea of doing more research and work on this was a very interesting one At liftoff especially if we are going to be doing liftoff in the near term the June–September time frame I would favor keeping the 50 basis point primary credit spread at that time then continuing to do work on the issue before we decideThank you,20150429
132,CHAIR YELLEN,CHAIR YELLEN President Williams,President Williams,20150429
133,MR WILLIAMS,MR WILLIAMS I just want to mention that there has been some loose talk about comparing the timing of these briefings to the morning call and I am not in favor of tying them to the morning call Let me be clear on that,I just want to mention that there has been some loose talk about comparing the timing of these briefings to the morning call and I am not in favor of tying them to the morning call Let me be clear on that,20150429
134,CHAIR YELLEN,CHAIR YELLEN Notice when I was faced with that I devised a way to end the requirement that—,Notice when I was faced with that I devised a way to end the requirement that—,20150429
135,MR WILLIAMS,MR WILLIAMS I call that leadership by— ,I call that leadership by—,20150429
136,CHAIR YELLEN,CHAIR YELLEN Thank you [Laughter],Thank you [Laughter],20150429
137,MR EVANS,MR EVANS So it can be done? That’s what you’re saying? ,So it can be done? That’s what you’re saying?,20150429
138,CHAIR YELLEN,CHAIR YELLEN It can be done It only took 50 years but— ,It can be done It only took 50 years but—,20150429
139,VICE CHAIRMAN DUDLEY,VICE CHAIRMAN DUDLEY It can be done,It can be done,20150429
140,CHAIR YELLEN,CHAIR YELLEN President Bullard,President Bullard,20150429
141,MR BULLARD,MR BULLARD Thank you Madam Chair Generally speaking I’m comfortable with the prescheduled staff meetings Based on the discussion here I’m wondering whether we need one every day Maybe twice a week—I’m picking up on some of the comments of Governor Tarullo I’m not sure how much information you’re going to get from Tuesday to Wednesday You could probably review this a couple of times a weekAlso picking up a little bit on themes Vice Chairman Dudley was talking about could you do this with a subcommittee of the FOMC? Do you really have to have the entire Committee reviewing what is supposed to be a technical issue? You could bring the whole Committee in if necessary but if everything’s going okay it seems that it could be done by subcommittee That’s something to think aboutOn the governance approach the first part was should we have a vote of the fomc to adjust ranges? I view this as pretty cumbersome for something that’s supposed to be a technical issue It sounds nontechnical It makes it sound like it’s a policy change regardless of what we say and so I see that as a difficult way to goNow for the Chair’s authority of 5 or 10 basis points first of all I think that moving these ranges should be subject to a high bar That’s one of my main comments You really don’t want to do this unless you really have to because of the communications issues that we’re going to encounter The payoff to doing this is ultimately pretty low For instance maybe the federal funds rate is trading a few basis points below the range and now you make this move Now the federal funds rate moves into the bottom part of the range So you’ve gained a few basis points but at the expense of markets asking “What are you guys doing? Are you changing policy?”Another question I have that has not come up yet is the authority to go 5 to 10 basis points over what time horizon Would you be able to go 5 basis points and then the next week another 5 basis points and the next week another 5 basis points? I don’t think that’s the intent but that’s something you’ve got to think about here And if you went the full 10 basis points and it didn’t work then I guess the whole Committee would have to come in at that pointI see a core problem here which we’ve talked about before in our discussions The Committee insists on saying that the federal funds rate is the policy rate but relatively few trades are occurring at that particular rate According to the Committee the rate is not the policy rate but on the other hand that is the rate that affects the largest banks in the country and it affects their funding costs And in other contexts we have said is our workhorse rateAnd then you’ve got overnight which we’re also saying is not a policy rate but which is for a market that has many traders and that is potentially large at the time of liftoff So we might say that the policy rate is the federal funds rate but what does that mean to markets? It’s really the markets that are saying what the policy rate is and if they think moving these other rates is more important than where the federal funds rate is trading then we’ve changed policy in a macroeconomic senseSo I think this is a conflict but that is part of the situation we’re in given the way we’ve decided to do this I think it does have potential to sound like a policy move to people inside financial markets even though we’re saying well the federal funds rate range has not changed and so we haven’t done anything different The bottom line is that I am worried about communications issues Because of that I don’t think you want to do this unless it’s absolutely necessary You know overall I would say 5 to 10 basis points per intermeeting period is okaywith me I would agree with President Rosengren that it might be premature to decide on this today You could make the delegation decision later around the time of liftoff if necessaryLet me finish with one story that old-timers here around the Federal Reserve will remember from the early 1990s I am going to mention “He-Who-Must-Not-Be-Named” who is former Chairman Alan Greenspan At the time it was considered that the Chairman had 25 basis points on the federal funds rate target and that the Chairman could make that adjustment during an intermeeting period without consulting the Committee And the Chairman at that time made a bunch of those moves and then came into the meeting and said “Now that I’ve made the move now we don’t have to move at the meeting” This was extremely hot and divisive on the Committee in the early 1990s We don’t want to get into any kind of situation like that and I know that’s not your intention but it is a bit of a slippery slope: What’s going to be delegated? Who’s agreed to it? How much have you agreed to? Under what circumstances? It is a very tricky issue and it has been a situation in the past on this Committee that has been problematic from a collegiality perspectiveI know we’re not really thinking about anything like that but I think it is a bit of a slippery slope You’ve got this issue about what rates really matter versus what rates we are calling the policy rate and you’ve got this precedent in the past when it didn’t go so well Thank you Madam Chair,Thank you Madam Chair Generally speaking I’m comfortable with the prescheduled staff meetings Based on the discussion here I’m wondering whether we need one every day Maybe twice a week—I’m picking up on some of the comments of Governor Tarullo I’m not sure how much information you’re going to get from Tuesday to Wednesday You could probably review this a couple of times a weekAlso picking up a little bit on themes Vice Chairman Dudley was talking about could you do this with a subcommittee of the FOMC? Do you really have to have the entire Committee reviewing what is supposed to be a technical issue? You could bring the whole Committee in if necessary but if everything’s going okay it seems that it could be done by subcommittee That’s something to think aboutOn the governance approach the first part was should we have a vote of the fomc to adjust ranges? I view this as pretty cumbersome for something that’s supposed to be a technical issue It sounds nontechnical It makes it sound like it’s a policy change regardless of what we say and so I see that as a difficult way to goNow for the Chair’s authority of 5 or 10 basis points first of all I think that moving these ranges should be subject to a high bar That’s one of my main comments You really don’t want to do this unless you really have to because of the communications issues that we’re going to encounter The payoff to doing this is ultimately pretty low For instance maybe the federal funds rate is trading a few basis points below the range and now you make this move Now the federal funds rate moves into the bottom part of the range So you’ve gained a few basis points but at the expense of markets asking “What are you guys doing? Are you changing policy?”Another question I have that has not come up yet is the authority to go 5 to 10 basis points over what time horizon Would you be able to go 5 basis points and then the next week another 5 basis points and the next week another 5 basis points? I don’t think that’s the intent but that’s something you’ve got to think about here And if you went the full 10 basis points and it didn’t work then I guess the whole Committee would have to come in at that pointI see a core problem here which we’ve talked about before in our discussions The Committee insists on saying that the federal funds rate is the policy rate but relatively few trades are occurring at that particular rate According to the Committee the rate is not the policy rate but on the other hand that is the rate that affects the largest banks in the country and it affects their funding costs And in other contexts we have said is our workhorse rateAnd then you’ve got overnight which we’re also saying is not a policy rate but which is for a market that has many traders and that is potentially large at the time of liftoff So we might say that the policy rate is the federal funds rate but what does that mean to markets? It’s really the markets that are saying what the policy rate is and if they think moving these other rates is more important than where the federal funds rate is trading then we’ve changed policy in a macroeconomic senseSo I think this is a conflict but that is part of the situation we’re in given the way we’ve decided to do this I think it does have potential to sound like a policy move to people inside financial markets even though we’re saying well the federal funds rate range has not changed and so we haven’t done anything different The bottom line is that I am worried about communications issues Because of that I don’t think you want to do this unless it’s absolutely necessary You know overall I would say 5 to 10 basis points per intermeeting period is okaywith me I would agree with President Rosengren that it might be premature to decide on this today You could make the delegation decision later around the time of liftoff if necessaryLet me finish with one story that old-timers here around the Federal Reserve will remember from the early 1990s I am going to mention “He-Who-Must-Not-Be-Named” who is former Chairman Alan Greenspan At the time it was considered that the Chairman had 25 basis points on the federal funds rate target and that the Chairman could make that adjustment during an intermeeting period without consulting the Committee And the Chairman at that time made a bunch of those moves and then came into the meeting and said “Now that I’ve made the move now we don’t have to move at the meeting” This was extremely hot and divisive on the Committee in the early 1990s We don’t want to get into any kind of situation like that and I know that’s not your intention but it is a bit of a slippery slope: What’s going to be delegated? Who’s agreed to it? How much have you agreed to? Under what circumstances? It is a very tricky issue and it has been a situation in the past on this Committee that has been problematic from a collegiality perspectiveI know we’re not really thinking about anything like that but I think it is a bit of a slippery slope You’ve got this issue about what rates really matter versus what rates we are calling the policy rate and you’ve got this precedent in the past when it didn’t go so well Thank you Madam Chair,20150429
142,CHAIR YELLEN,CHAIR YELLEN Thank you Governor Fischer,Thank you Governor Fischer,20150429
143,MR FISCHER,MR FISCHER Thank you Madam Chair I’m comfortable with the governance approach in the first two weeks of scheduling daily staff briefings but I assume that we’ll quickly work out whether we need them every day and we can probably unschedule a few of them within a day or two So I think there’s some flexibility thereWith regard to the governance approach for technical adjustments in the or on rates I don’t know about previous Chairmen I’ve only had one Chair in my life on the Board and my experience with that Chair is that if there is going to be any question about a need for discussion she will call for it I haven’t detected her trying to get around the fomc or the Board and I think we can rely on that So I’d be perfectly willing to give the Chair an adjustment up to 10 basis points I agree that we need to specify that the discretion would be granted between meetingsI’m not sure about the wisdom of constraining the gap between the on and rates to 25 basis points We may find reasons why we need to move one without moving the other and my general approach is don’t constrain yourself if there’s no need to constrain yourself because the law of unintended consequences is very powerfulOn the primary credit rate I agree with those who think we should try to minimize the number of adjustments we make at the time of liftoff and that this issue is sufficiently important for banks to which we give a lot more attention than their size would imply I’m not sure why we would want to start by raising the cost of borrowing by 50 basis points for the smaller banks who do borrow at that rate and we’d need to look at what would happen when we raise the rate And so for both reasons I favor examining that after liftoff Thank you Madam Chair,Thank you Madam Chair I’m comfortable with the governance approach in the first two weeks of scheduling daily staff briefings but I assume that we’ll quickly work out whether we need them every day and we can probably unschedule a few of them within a day or two So I think there’s some flexibility thereWith regard to the governance approach for technical adjustments in the or on rates I don’t know about previous Chairmen I’ve only had one Chair in my life on the Board and my experience with that Chair is that if there is going to be any question about a need for discussion she will call for it I haven’t detected her trying to get around the fomc or the Board and I think we can rely on that So I’d be perfectly willing to give the Chair an adjustment up to 10 basis points I agree that we need to specify that the discretion would be granted between meetingsI’m not sure about the wisdom of constraining the gap between the on and rates to 25 basis points We may find reasons why we need to move one without moving the other and my general approach is don’t constrain yourself if there’s no need to constrain yourself because the law of unintended consequences is very powerfulOn the primary credit rate I agree with those who think we should try to minimize the number of adjustments we make at the time of liftoff and that this issue is sufficiently important for banks to which we give a lot more attention than their size would imply I’m not sure why we would want to start by raising the cost of borrowing by 50 basis points for the smaller banks who do borrow at that rate and we’d need to look at what would happen when we raise the rate And so for both reasons I favor examining that after liftoff Thank you Madam Chair,20150429
144,CHAIR YELLEN,CHAIR YELLEN Thank you Governor Powell,Thank you Governor Powell,20150429
